,Document_No,Dominant_Topic,Topic_Perc_Contrib,Keywords,Story_Id,Title,Abstract
0,0,6.0,0.9991000294685364,"Auge, Tier, Mutter, Hand, Erde, Baum, Kind, Kopf, Eltern, Haus",19,Radio Über-All,"Dich quälen Fragen zum Klimawandel? 

Schlechte Luft macht dich so platzwütend wie Krumpel?

Schalte Radio-Überall ein!
Die Sendung mit 6 Ideen zur Rettung des Klimas! 
6 komische, absurde und wissenschaftliche Vorschläge: Damit es nicht so heiß wird auf der Erde. 

Wie gefällt dir die Idee, die Erde einfach ein wenig von der Sonne weg zu schubsen? Findest du sie genauso so großartig wie Krumpel?  Oder hast du Angst vor dem Sprung auf eine neue Umlaufbahn?

Dann setz dich unter einen Sonnenschirm auf eine grüne Wiese, denn du verlierst deine Angst dabei!

Stay tuned - bleib dran!
Mit Krumpel, Ada und Adama.


"
1,1,0.0,0.9991000294685364,"Auge, Mutter, Kind, Baum, Kopf, Vater, Hand, Wasser, Frau, Welt",21,Unser Dorf pflanzt Sauerstoff,"Mathilda wünscht sich Schnee, um mit ihren Freunden  zum Rodeln zu gehen. Doch die Erde schwitzt, so dass es nicht schneit. Mathilda hat einen Plan dies zu ändern. Jeder braucht nur 131 Bäume pflanzen. Zusammen mit den Klassenkameraden der 6b versucht Mathilda das Dorf zu überzeugen. Wird der Plan aufgehen?

Eine Geschichte über Mut, Gemeinschaft und den Willen etwas zum Positiven zu verändern.

 "
2,2,13.0,0.6546000242233276,"Erde, Wasser, Mutter, Kopf, Haus, Auge, mein, Vater, Eltern, Baum",24,Das Märchen vom Klimawandel,"Die Stiefmutter fährt SUV, dem Wolf wird der Wald abgeholzt, und der Frosch ist eigentlich ein verzauberter Wissenschaftler...ein modernes Märchen über den Klimawandel."
3,3,1.0,0.9869999885559082,"Vater, Mutter, Hand, Papa, Erde, Wasser, alt, Freund, Kopf, mein",25,Die drei Geister des Klimawandels,"Bernd ist kein schlechter Kerl, aber er lässt sich nicht gern belehren – vor allem nicht über den Klimawandel. Das bekommt auch die 12-jährige Lea zu spüren, die sich viele Gedanken über umweltfreundliches Verhalten macht. Bernd hat dafür kein Verständnis. Doch dann bekommt er eines Nachts Besuch von drei Geistern. Sie zeigen ihm das Klima der Vergangenheit, der Gegenwart und der Zukunft. Und in dieser spielt auch Lea eine wichtige Rolle…"
4,4,5.0,0.9990000128746033,"Tier, Frau, Wald, Auge, Haus, Vater, alt, mein, Mutter, Freund",27,"Vaiko, der vegetarische Vampir","Im idyllischen Transsilvanien lebt Vaiko mit seiner Vampirfamilie. Er liebt es nachts durch die Wälder zu streifen und sein Futter, die Ratten, zu suchen. Doch die anderen Vampire wollen nicht mehr ihr Futter selber suchen. Da hat Vladi, Vaikos Vater, eine gute Idee. Er lässt einen Holzstall bauen und züchtet die Ratten selber. Alle Vampire sind begeistert. Nur Vaiko nicht. Er sieht, wie schlecht es den Tieren geht und was die Massentierhaltung der Umwelt antut. Er entscheidet sich gegen das Essen der Tiere. Aber gibt es wirklich vegetarische Vampire? Die Situation wird für Vaiko immer schwieriger, bis sein Vater Vladi zu einer folgenschweren Entscheidung kommt. Vaiko steht nun ganz alleine da. Trotzdem kämpft er mutig für das Wohl der Tiere und den Schutz der Umwelt."
5,5,17.0,0.49230000376701355,"Hand, Kopf, Erde, Auge, Kind, Frau, Mutter, alt, Wald, Tier",28,Mariposa de Cristal,"Corinna und ihr kleiner Bruder Kuni gehen mit einem kleinen Alien auf Schmetterlingssuche in den Regenwald. Dort entdecken sie nicht nur viele unglaublich schöne Tiere, sondern müssen auch zusehen, wie etwas Schreckliches mit der Natur geschieht. Kann der Anblick eines kristallenen Schmetterlings die Menschen eines Besseren belehren?"
6,6,17.0,0.9991000294685364,"Hand, Kopf, Erde, Auge, Kind, Frau, Mutter, alt, Wald, Tier",64,Rinderwahn,Auf einer Weide steht ein Bulle und frisst zu viel. Das entfacht eine hitzige Debatte - nicht nur unter seinen Kuhkollegen.
7,7,9.0,0.8848999738693237,"Frau, Eltern, Baum, Vater, alt, Auge, Hand, mein, Mama, Mutter",68,Rettungsmission im Paradies,"Die 12jährige Maren dachte, dass sie einfach einen Urlaub mit ihren Eltern in der Karibik verbrigen würde. Sonne, Meer, Surfen. Doch dann kam alles anders. Müll, wohin sie auch sah, und das selbst in diesem Ferienparadies. Als sie beim Müll aufsammeln auf eine verrostete Drohne stieß,, wollte sie ihren Augen nicht trauen. Das Ding sprach und überbrachte ihr eine Botschaft: Rette das Paradies! "
8,8,12.0,0.5551999807357788,"Auge, Erde, Hand, Baum, Schule, Welt, Eltern, Papa, Wasser, Frau",69,Schollenexpedition,"Leon, Tobi und ihr Pferd Mogul werden von den Bürgern von Exmilanium losgeschickt, die große Eisscholle zu untersuchen. Sie sollen herausfinden, wie stark die Scholle geschmolzen ist. Auf dem Weg dorthin müssen sie sich durch Schneestürme kämpfen und die Eisbären überzeugen, dass sie in guter Absicht kommen. Dabei hilft ihnen Leons Photonenhelm und Tobis Energiestab. Aber auch ohne Moguls Intuition wären sie aufgeschmissen. "
9,9,0.0,0.414900004863739,"Auge, Mutter, Kind, Baum, Kopf, Vater, Hand, Wasser, Frau, Welt",72,Zira - Die Klima-Prinzessin von Ona ,"Zira kommt vom Planet Ona, der früher dem der Erde glich. Das Klima hat Ona fast zerstört. Zira kann auf die Erde flüchten. Dort trifft sie auf den gleichaltrigen Ben und versucht ihm zu erklären, was passiert ist. Doch Ben interessiert sich nicht für das Klima. Bis ...



"
10,10,8.0,0.9976999759674072,"Auge, Vater, Mutter, Eltern, Tier, Welt, Kind, Haus, alt, Erde",74,Hoffnung,"
Lisa und ihre Familie stehen vor dem Nichts: Gewaltige Feuer haben ihren Bauernhof zerstört und die ganze Region verbrannt. Da begegnet Lisa ein Hund, der sprechen kann und behauptet, aus der Quantenwelt zu kommen. Er verspricht ihr zu helfen und stellt ihr seine tierischen Freunde vor. Die haben ihr viel zu sagen ..."
11,11,16.0,0.5339000225067139,"Vater, Wald, Auge, Tier, mein, Kopf, Frau, Eltern, Mutter, Erde",94,Auf Sand gebaut,"Leenkes Papa gehört das Kieswerk am Ortsrand. Zur Erweiterung des Abbaugebietes soll der angrenzende Wald weichen.  Dieses Vorhaben spaltet nicht nur das Dorf, sondern stellt vor allem Leenke vor eine große Herausforderung. Im Rahmen der Projektwoche wird sie in der Schule massiv angefeindet und ausgegrenzt. Am härtesten trifft sie, dass ihr heimlicher Schwarm Pit ihren Vater als ""die größte Umweltsau des Dorfes"" betitelt. Kann sich Leenke aus dieser bedrückenden Situation befreien? Ist vielleicht sogar eine Rettung des Waldes möglich? "
12,12,17.0,0.9666000008583069,"Hand, Kopf, Erde, Auge, Kind, Frau, Mutter, alt, Wald, Tier",100,Wie das Müllmonster besiegt und Prinzessin Klimatina gerettet wurde,"Das kleine Königreich Deponia wird von einem Müllmonster bedroht, dass das ganze Land verdreckt und die Flüsse verseucht. Schließlich entführt es sogar die Kronprinzessin Klimatina. Wird es dem tapferen Jungen Solarius und seinem treuen Esel Teslo gelingen, die Prinzessin zu befreien und das Monster zu besiegen?"
13,13,8.0,0.9555000066757202,"Auge, Vater, Mutter, Eltern, Tier, Welt, Kind, Haus, alt, Erde",105,Das Haus der ewigen Echos,"Ein Junge wird eines nachts plötzlich von einem sprechenden Eichhörnchen geweckt. Es erzählt dem Jungen von einer bevorstehenden Katastrophe und nimmt ihn mit ein ""Haus der ewigen Echos"". In einer zauberhaften Villa begegnet der Junge Tieren, die eigentlich schon ausgestorben sein müssten. Zusammen mit anderen geheimnisvollen Wesen erklären sie dem Jungen die Konsequenzen von menschlichem Handeln und was es heißt, ein verantwortungsvolles Leben zu führen."
14,14,17.0,0.9988999962806702,"Hand, Kopf, Erde, Auge, Kind, Frau, Mutter, alt, Wald, Tier",107,Sterne,"Wenn wir sterben, werden wir zu funkelnden Sternen. Das hat Lisis Mutter ihr kurz vor ihrem Tod erzählt. Jedoch werden die Sterne immer häufiger vom Dampf und Rauch der Flugzeuge und Waldbrände verdeckt, weshalb Lisi beschliesst, mit anderen Jugendlichen auf diesem Umstand hinzuweisen. Immer mitternachts schleichen sie mit Kerzen auf den Friedhof und erschaffen selbst ein Meer aus Sternen. So wollen sie auf die drohende Umweltkatastrophe hinweisen und ihre Trauer sichtbar machen. "
15,15,13.0,0.9728999733924866,"Erde, Wasser, Mutter, Kopf, Haus, Auge, mein, Vater, Eltern, Baum",110,Kailano und die Qualmpulverschnur,"Kailano lebt auf einer paradiesischen kleinen Vulkaninsel mitten im Meer. Eines Tages entdeckt er eine gräulich glänzende Schnur, die er mit einiger Mühe aus dem Vulkanboden zieht. Die Schnur ist das reinste Wunder: Sie macht Dinge leichter, und macht selbst Hühnereier unzerbrechlich. Und schaut man durch sie hindurch, wirkt alles bunt und wunderschön. Doch die anderen Inselbewohner werfen die tollen Schnüre einfach so weg, bis sie ins Meer geweht werden. Und plötzlich entdeckt Kailano etwas Furchtbares... Er muss sich gleich drei Pläne einfallen lassen."
16,16,8.0,0.9979000091552734,"Auge, Vater, Mutter, Eltern, Tier, Welt, Kind, Haus, alt, Erde",114,"Fitti, der fliegende Hot- Dog","   „Quiek!"" Jonna traute ihren Ohren nicht, als sie in den Hot- Dog biss. Doch als Fitti, der fliegende Hot- Dog, sie eines Nachts mit zu den brennenden Regenwäldern nahm, gingen ihr die Augen auf. Erst hatte sie natürlich Angst. So ein Abenteuer hatte sie schließlich noch nie erlebt. Aber dann war es doch ziemlich aufregend, was sie da erlebte. Sie und die vielen anderen Kinder, die sie dort traf, hatten ja keine Ahnung gehabt, was mit dem Klima geschah. Doch das würde sich jetzt ändern ...
"
17,17,1.0,0.640999972820282,"Vater, Mutter, Hand, Papa, Erde, Wasser, alt, Freund, Kopf, mein",118,Ein kleiner Zweig vom großen Baum,"Der Weihnachtsbaum ist aufgestellt und sein Duft genügt, um Juna mitten in die ersehnte Weihnachtstimmung zu katapultieren. Aber wo ist der Schnee und was kann man tun, um den Winter wieder hervorzulocken?

Ein Besuch im Gartencenter öffnet Juna die Augen und schon kommen ihr erste Ideen, wie man sie es schaffen kann, die Erwachsenen zum Umdenken zu bewegen. Dafür braucht es keine neuen Erfindungen!
Eine geistreiche Idee und etwas Glühwein genügen."
18,18,5.0,0.8158000111579895,"Tier, Frau, Wald, Auge, Haus, Vater, alt, mein, Mutter, Freund",119,Die Geschwindigkeit der Zeit ändert sich,"Es ist ein heißer Juli Tag. Es schien die Sonne, Vögel zwitschern, Leute kühlen sich im Wasser ab und holen sich Eis an den verschiedenen Verkaufsstandeln. 
Zumindest war das bis heuer so. Plötzlich fängt es an zu schneien, Keller werden überflutet und weiterer Naturkatastrophen gestalteten das Leben auf der Erde immer schwieriger. Das Schlimmste ist jedoch: Die Erwachsenen bemerken es nicht einmal! 
Um die Erde vor dem Untergang zu bewahren, stellen sich Mia und ihre Freunde den schlimmen Katastrophen des Klimawandels  entgegen. Können sie die Erde noch rechtzeitig retten oder ist es bereits zu spät?"
19,19,11.0,0.6764000058174133,"Auge, Welt, Haus, Baum, Hand, Erde, Frau, Eltern, Luft, alt",121,Schwarzer Sand,"Sonja und ihre Familie verbringen ihren Urlaub auf Korsika. Ihr Strand wurde durch Öl verschmutzt. Die Familie beginnt die Hintergründe dieser kriminellen Tat zu ermitteln und gerät dabei selbst in Gefahr.
"
20,20,5.0,0.5414999723434448,"Tier, Frau, Wald, Auge, Haus, Vater, alt, mein, Mutter, Freund",124,Ein umweltfeindlicher Stundenplan ,"Als Lara erfährt, dass ihr Direktor Herr Lehmann die an der Schule angrenzende Natur zerstören will, um das Gebäude zu vergrößern, setzt sie mit ihrem besten Freund Fynn alles daran, diesen umweltfeindlichen Plan zu durchkreuzen. Gemeinsam finden sie heraus, welche Folgen dieses Vorhaben hat und geben nicht auf, ehe die Katastrophe verhindert ist. Dabei erkennen sie nicht nur, wie wichtig es ist für das Richtige zu kämpfen, sondern auch, dass man gemeinsam alles erreichen kann. "
21,21,11.0,0.9988999962806702,"Auge, Welt, Haus, Baum, Hand, Erde, Frau, Eltern, Luft, alt",125,Lucio und der Planet B,"Es gibt keinen Planet B. Oder? Lucio hat eine Mission: Seine eigene Welt hat durch den Klimawandel großen Schaden genommen. Jetzt liegt es an ihm, die Parallelerde zu retten und seine Heimat zu unterstützen. "
22,22,11.0,0.5946999788284302,"Auge, Welt, Haus, Baum, Hand, Erde, Frau, Eltern, Luft, alt",131,Wildbienenfieber,"Der elfjährige Mats, ein talentfreier Hobbyzauberer, träumt insgeheim davon, wenigstens seine Freundin Pauline einmal mit einem Zaubertrick beeindrucken zu können. 

Als Paulines Eltern – beide Wissenschaftler – zeitgleich beruflich verreist sind um sich unter anderem über Folgen des Klimawandels auszutauschen, die ihr jeweiliges Forschungsgebiet betreffen, leistet Mats seiner Freundin selbstverständlich Gesellschaft. 
Der ursprüngliche Plan der beiden, eine Wildbienennisthilfe für den Garten zu bauen, gerät jedoch schnell ins Hintertreffen, als Mats ganz unbeabsichtigt die Sensation gelingt: ein waschechter Zauber, der Pauline plötzlich sechs Beine und zwei Paar Flügel beschert …
"
23,23,17.0,0.7734000086784363,"Hand, Kopf, Erde, Auge, Kind, Frau, Mutter, alt, Wald, Tier",132,Was die Welt im Innersten zusammenhält,"Umweltkatastrophen, Schnelllebigkeit und ein zunehmender Egoismus in der Gesellschaft: All das scheint unsere heutige Zeit zu prägen. In diesen ganzen Turbulenzen kehrt man viel zu selten zu den Fragen zurück: Was ist der Mensch eigentlich? Was ist Zeit? Und was macht der Mensch mit der Zeit und der einzigen Erde, die ihm noch bleibt?
Die beiden jungen Erwachsenen Amina und Felix begegnen sich auf einer Zugfahrt und diskutieren über die Fragen des Lebens. Aber was ist diese eine Kraft, die die Welt im Innersten zusammenhält? Um auf Goethe zu antworten stellt Amina eine gewagte These in den Raum: Der Mensch ist von Grund auf gut. 
Mit naivem Leichtsinn tauchen Amina und Felix ein in eine abstrakte Welt der Physik. Von Quantenphysik bis Magnetismus begibt sich der Leser auf eine kurze Reise durch die Zeit. 
Bleibt die Menschheit bloß ein Wimpernschlag in der Erdgeschichte und sprängt sich selbst in die Luft oder gibt es noch Hoffnung?
Amina und Felix sind sich einig: Gemeinsam können wir alles schaffen! Denn ja: Der Mensch ist auch gut. Wir haben es in der Hand!
Die Geschichte lässt den Leser mit vielen offenen Fragen zurück. Sie soll zum Nachdenken und Handeln anregen."
24,24,9.0,0.5871000289916992,"Frau, Eltern, Baum, Vater, alt, Auge, Hand, mein, Mama, Mutter",138,"Kai, Kim und die Steinwüsten","Die Zwillinge Kai und Kim ärgern sich über die Steinwüsten in ihrem Wohnviertel. Alle Vorgärten sind einbetoniert oder voller Steine. Nur in ihrem eigenen Vorgarten wachsen noch grüne Pflanzen und Blumen. 
Die Zwillinge beschließen aktiv zu werden und räumen in einer ""Nights for future""-Aktion die Steine aus dem Vorgarten der Nachbarin weg. Natürlich gibt das ein Heidentheater, aber schließlich schaffen die Beiden es, das gesamte Viertel wieder zu einer blühenden Oase zu machen, so dass das Aufheizen der Wohngegend durch die Erderwärmung verhindert wird und das Regenwasser wieder durchsickern kann."
25,25,12.0,0.963100016117096,"Auge, Erde, Hand, Baum, Schule, Welt, Eltern, Papa, Wasser, Frau",139,Der dicke Baum,"Der dicke Baum ist Lebensraum und Zufluchtsort für viele, verschiedene Tiere. Als der Bussard Achim ankommt und in den Ästen sein Nest bauen will, gibt es Aufregung. Rita, das Eichhörnchen, fühlt sich bedrängt und fordert vom Baumrat eine Entscheidung. Da Achim sein altes Zuhause verloren hat, darf er bleiben. Die Eule Hermine, Vorsitzende des Rates, ist von Achims Geschichte, der über die Zerstörung des Waldes und der Landschaft berichtet, tief betroffen und sorgt sich um den eigenen Baum. Bald darauf droht dem dicken Baum tatsächlich ein ähnliches Schicksal. Aber die Baumbewohner wollen ihren Lebensraum verteidigen und schmieden einen Plan.  "
26,26,0.0,0.9990000128746033,"Auge, Mutter, Kind, Baum, Kopf, Vater, Hand, Wasser, Frau, Welt",140,Luftwege,"Ein Virus hat das bewirkt, was zahlreiche Klimaschützer nicht konnten - der internationale Flugverkehr wurde fast komplett eingestellt. Leonore hat die letzten zwei Jahre aus Angst vor dem Virus zuhause verbracht und ihre Freunde nur online getroffen. Das stillgelegte Flugfeld neben ihrem Wohnort war der einzige Ort, an dem sie draußen sein konnte und über die Monate konnte sie beobachten, wie sich die Natur den Platz zurückeroberte. Seit einigen Monaten scheint die Gefahr des Virus gebannt und so etwas wie Normalität scheint in das Leben der Menschen einzukehren. Die Kinder gehen wieder in die Schule, die Erwachsenen in die Arbeit und Pläne beginnen, alles wieder so zu machen wie es vorher war - auch das Flugfeld soll wiederhergestellt und ausgebaut werden um den Flugverkehr wieder anzukurbeln.
Doch Leonore merkt jetzt schon, wie die Luftqualität wieder schlechter wird, und als sie Paul trifft, dessen Asthma plötzlich wieder zurück ist, weiß sie, dass sie etwas unternehmen muss.
Gemeinsam mit den anderen Kindern in ihrer Umgebung versucht Leonore zu verhindern, dass alles genauso wird wie es früher war und setzt sich für ein Naturschutzgebiet an Stelle des alten Flughafens ein..."
27,27,12.0,0.9990000128746033,"Auge, Erde, Hand, Baum, Schule, Welt, Eltern, Papa, Wasser, Frau",142,Paco,"Während Paco in den bolivianischen Anden auf seine Vikunjaherde aufpasst, reißt ein Erdrutsch einige der Tiere in den Tod. Sein Lehrer erkennt schnell die Ursache: die Abholzung und den Verbiss der Tiere. Mit seiner Hilfe wollen die Schüler durch Baumpflanzungen solchen Unglücken zukünftig entgegenwirken.  Ein von terre des hommes unterstütztes Projekt."
28,28,0.0,0.9990000128746033,"Auge, Mutter, Kind, Baum, Kopf, Vater, Hand, Wasser, Frau, Welt",177,"Emma, die Trostweide","Fast jeden Tag besucht Anni ihre Freundin Emma. Emma ist eine Trauerweide, von Anni jedoch liebevoll Trostweide genannt.
Denn mit ihren zauberhaften Geschichten entführt sie Anni aus dem Schulalltag und bringt sie auf andere Gedanken - vor allem, wenn Anni mal wieder von Yannick geärgert wurde...
Er macht sich ständig darüber lustig, dass sie Müll sammelt, mit Trinkflaschen und Brotdosen zur Schule kommt und im Sommer die Bäume gießt.
Und dass ihre Mutter verhindern will, dass Yannicks Vater den letzten Wald des Ortes abholzt, um dort einen Golfplatz zu bauen, verbessert das Verhältnis zwischen Anni und Yannick auch nicht gerade.
Was sie dann allerdings eines Tages auf dem Heimweg mit ihm erlebt, hätte sie in ihren schlimmsten Träumen nicht befürchtet..."
29,29,12.0,0.9988999962806702,"Auge, Erde, Hand, Baum, Schule, Welt, Eltern, Papa, Wasser, Frau",180,Mias Gedankenchaos,"
Mia ist vierzehn Jahre alt und hat tausend Gefühle im Herzen. Wie bekommt man das Chaos in den Griff? Hilft es, alles aufzuschreiben oder ist es moderner seinen eigenen Blogg zu haben? Wieso erwartet anscheinend jeder, dass man immer gute Laune hat? In Mias Lieblingsphantasie geht die Erde einfach mit einem großen Knall unter. Ob das die Lösung ist?
"
30,30,11.0,0.4097999930381775,"Auge, Welt, Haus, Baum, Hand, Erde, Frau, Eltern, Luft, alt",185,Emi Ökotante vs. Lotte Klimaschreck,"Die beiden Siebtklässlerinnen Emi Oberlande und Lotte Kirmaschek sind wie Feuer und Wasser. Während Emi schon von kleinauf versucht, die Welt zu retten, sind Lotte Umwelt- und Klimaschutz völlig egal. Sie ist sich selbst am nächsten und macht sich tagtäglich einen Spaß daraus, ""Ökotante"" Emi mit ihrem Umwelttick aufzuziehen. Doch das taffe Mädchen lässt sich davon nicht vom Kurs abbringen und bietet ihrer Rivalin, die sie insgeheim ""Lotte Klimaschreck"" nennt, immer wieder die Stirn. Unbeeindruckt zieht sie ihr persönliches Klima-Rettungsprogramm durch, das sie akribisch in ihren Klima-Tagebüchern dokumentiert. Eines Tages kreuzen sich Emis und Lottes Wege und plötzlich versteht selbst die sonst so egoistische Lotte, dass ein bisschen Weitsicht und Nachhaltigkeit nicht schaden kann. Denn Emi hat sie und viele andere mit einem ganz speziellen Virus angesteckt, der beweist, dass jeder einzelne von uns ein Klimaheld sein kann.   "
31,31,12.0,0.9987000226974487,"Auge, Erde, Hand, Baum, Schule, Welt, Eltern, Papa, Wasser, Frau",187,Ein Projekttag und jede Menge Chaos,"Lina ist die Umwelt sehr wichtig. Deshalb fährt sie mit dem Fahrrad zur Schule und kauft ihre Kleider auf dem Flohmarkt. Nicht jeder versteht das. Ganz und gar nicht verstehen es Noah, Kilian und Leon aus ihrer Klasse. Die machen sich darüber eher lustig. Um auch ihren Klassenkameraden zu zeigen, wie wichtig es ist, das Klima zu schützen, plant Lina mit ihrer Klassenlehrerin einen Projekttag. Doch an diesem kommt alles anders als erwartet..."
32,32,13.0,0.8924000263214111,"Erde, Wasser, Mutter, Kopf, Haus, Auge, mein, Vater, Eltern, Baum",188,Das Müllmonster,"Das Müllmonster und der Regenwurm


Muff, das Müllmonster, war äußerst schlecht gelaunt. Warum, das wusste er gar nicht so genau. Die Maus und viele andere Tiere halfen ihm dabei, wieder froh und glücklich zu sein und dabei noch etwas für die Umwelt zu tun. Es passieren viele spannende Abenteuer, lasst euch überraschen ......."
33,33,7.0,0.9380999803543091,"Erde, Kind, Auge, Vater, Hand, Mutter, Haus, Wasser, Schule, Mama",189,Oma Honki ,"Neufrankfurt, 2117. Schulen gibt es noch immer. Präsentationen auch.
Paula und Navid machen sich zu zweit an die Arbeit. Sie interviewen die alte und furchteinflößende Oma Honki. Fasziniert und entsetzt erfahren sie von 2024 – dem Jahr, das alles veränderte und in dem Oma Honki genauso alt war wie Paula und Navid jetzt."
34,34,6.0,0.5745000243186951,"Auge, Tier, Mutter, Hand, Erde, Baum, Kind, Kopf, Eltern, Haus",194,Ninas Einsatz,"Nina kennt sich ziemlich gut in der Natur aus. Nicht nur zuhause auf dem Birkenhof setzt sie sich für die Umwelt ein, auch in der Schule ist sie bei den Fridays-for-Future-Aktionen aktiv. 
Als sie mit ihrem Rad zur Streuobstwiese fährt um Nistkästen aufzuhängen, beobachtet sie Bauer Bockel, der im Wasser- und Naturschutzgebiet Gülle ausfährt. Eine totale Katastrophe für die dort wachsenden Himmelsschlüsselchen und Orchideen. Schnell will sie Hilfe holen, doch sie stürzt und verliert ihr Gedächtnis. Wird Sternchen, ihr Pferd, sie finden? Gibt es ein Zurück aus dem Vergessen und Hoffnung für die zerstörte Natur?…."
35,35,12.0,0.6791999936103821,"Auge, Erde, Hand, Baum, Schule, Welt, Eltern, Papa, Wasser, Frau",198,Hinter dem Regenbogen,"Der wissenhungrige und lebhafte Unternehmerssohn Allen wird zum Initiator und Gründer der Grüne-Biker-Gang HINTER DEM REGENBOGEN, nachdem er in einem Umweltmagazin über die fatalen Folgen des Klimawandels gelesen hatte. Seine Fahrrad-Gang und er nehmen die Herausforderung neuer Ziele zur Aufklärung und Motivation für eine bessere Umwelt ernst und werden in ihrer Stadt und in der Firma von Allens Vater aktiv, welche Raumfahrt-Equipment hergestellt."
36,36,0.0,0.8356000185012817,"Auge, Mutter, Kind, Baum, Kopf, Vater, Hand, Wasser, Frau, Welt",199,Oma erzählt,"Marie radelte voller Vorfreude an den bunten Wiesen vorbei. Heute war wieder Oma-Tag. Die beiden unternahmen stets wunderschöne Dinge, die Maries Herz zum Hüpfen brachte. 
Was sie dabei am meisten liebte, waren Omas Geschichten.  Besonders die, die von der Zeit vor dem ""Großen Erwachen""  erzählten, als Mama Gaia, ihre geliebte Erde,  fast gestorben wäre. Doch dann geschah ein Wunder...

"
37,37,6.0,0.38760000467300415,"Auge, Tier, Mutter, Hand, Erde, Baum, Kind, Kopf, Eltern, Haus",201,Alles nur wunschgedacht?,"Ein Wunsch frei. Wer träumt nicht davon? Für alle anderen scheint klar zu sein, was man sich da heutzutage wünschen sollte: kein Klimawandel natürlich! Offensichtlich scheinen sich dem zumindest alle außer mir bewusst zu sein. 
In meiner Schule werden regelmäßig diejenigen ausgelacht und beschimpft, die sich nicht den teuren veganen Aufschnitt leisten können, die nicht so viel über die Klimakrise wissen, und die, die beispielsweise wegen eines Rollstuhls mit den Auto zur Schule gebracht werden müssen. Ich finde das gemein und frage mich immer öfter, ob wir den Klimawandel nicht besser miteinander als gegeneinander besiegen sollten...
Ich habe meinen Wunsch schon ausgesprochen und - zack - zu spät. Vom einen auf den anderen Moment scheinen mich die anderen zu hassen: ""Du hättest das Klima mit einem Satz retten können!"" Dass dieser Tag, an dem ich mir eben nicht den Klimawandel weggewünscht habe, doch noch eine enorme Wendung nimmt, zeigt, dass mein Wunsch wohl doch nicht so übel war... "
38,38,19.0,0.9990000128746033,"Hand, Schule, mein, Frau, Kind, Mutter, alt, Erde, Tier, Papa",202,Nádar das Naturkind,"Emilia ist zehn und gerade in die Realschule gekommen. Einer ihrer neuen Mitschüler ist Nádar. Alle sagen immer der ist komisch. Und irgendwie stimmt das auch. Denn der Junge redet oft verwirrtes Zeug. Eines Tages auf dem Nachhauseweg, beobachtet Emilia Nádar dabei, wie er im Stadtpark Wasser herbeizaubert, damit halb vertrocknete Blumen gießt und sie wieder zum blühen bringt. Nádar ist ein Kind der Natur und hat deshalb magische Fähigkeiten. Er zeigt ihr, wozu die Natur gut ist und das man darin Spaß haben kann, aber auch, dass sie bedroht ist. Besonders durch den Bau einer neuen Süßwarenfabrik, am Fluss. Diese Fabrik lässt Emilias Onkel Hans errichten. Emilia möchte helfen. Doch zunächst will niemand auf sie hören. Schließlich kann sie ihre Mitschüler überzeugen, etwas zu unternehmen.
Mit vereinten Kräften versuchen die Kinder den Onkel zu überzeugen seine Fabrik umweltfreundlich zu bauen, doch dazu braucht es mehr, als Worte. Werden sie es schaffen?"
